{
  "application_id": "fff-writer-proposal-application-v1-001",
  "applied_decision_ids": [
    "decision-replace-opening-wording",
    "decision-accept-relation-explanation",
    "decision-accept-motive-undecided"
  ],
  "base_narrative_ir_identity": {
    "byte_size": 55006,
    "narrative_ir_id": "narrative-ir-writer-proposal-roundtrip",
    "sha256": "3f15434f63ed26b6aae8adfb6f3929ded4c1c88b9d4925462625e21889d2f0a5"
  },
  "candidate_only": true,
  "decision_results": [
    {
      "accepted_text_provenance": {
        "byte_range": {
          "end": 301,
          "start": 229
        },
        "character_range": {
          "end": 185,
          "start": 161,
          "unit": "utf16_code_unit"
        },
        "decision_record_id": "decision-replace-opening-wording",
        "exact_text_sha256": "ec003f03d958ec74762ce04001c415a92a6e47c2beaded42a27be2da521ea547",
        "source_kind": "writer_authored_proposal",
        "source_path": "fixtures/writer-decision-workspace/writer-proposals.md",
        "source_span_id": "proposal-span-proposal-replace-opening-wording"
      },
      "action": "replace",
      "application_status": "APPLIED_TO_CANDIDATE_SUCCESSOR",
      "applied": true,
      "decision_record_id": "decision-replace-opening-wording",
      "impact_classification": "L0 wording only",
      "proposal_id": "proposal-replace-opening-wording",
      "proposal_text": "正午、鐘のない塔で鐘の音が響いたとの報告がある。",
      "proposal_text_provenance": {
        "exact_text_sha256": "ec003f03d958ec74762ce04001c415a92a6e47c2beaded42a27be2da521ea547",
        "source_kind": "writer_authored_proposal",
        "source_path": "fixtures/writer-decision-workspace/writer-proposals.md",
        "source_span_id": "proposal-span-proposal-replace-opening-wording"
      },
      "regenerated_section_ids": [
        "case-digest-section-01-incident"
      ]
    },
    {
      "action": "missing",
      "application_status": "UNAPPLIED_MISSING_DECISION",
      "applied": false,
      "decision_record_id": null,
      "impact_classification": "L1 subject explanation",
      "proposal_id": "proposal-clarify-moth-unknown",
      "proposal_text": "その働きは、まだ分からない。",
      "proposal_text_provenance": {
        "exact_text_sha256": "33ef0b68341c3e7b92fea840c5c33302dd95df06e836a11fedbe568d3e9967ad",
        "source_kind": "existing_revision_example",
        "source_path": "artifacts/editorial-revision/revision-request.example.json",
        "source_span_id": "span-proposal-clarify-moth-unknown-existing-revision"
      }
    },
    {
      "action": "missing",
      "application_status": "UNAPPLIED_MISSING_DECISION",
      "applied": false,
      "decision_record_id": null,
      "impact_classification": "L1 subject explanation",
      "proposal_id": "proposal-remove-repeated-clue-wording",
      "proposal_text": null,
      "proposal_text_provenance": {
        "exact_text_sha256": null,
        "source_kind": "none",
        "source_path": null,
        "source_span_id": null
      }
    },
    {
      "accepted_text_provenance": {
        "byte_range": {
          "end": 531,
          "start": 450
        },
        "character_range": {
          "end": 317,
          "start": 290,
          "unit": "utf16_code_unit"
        },
        "decision_record_id": "decision-accept-relation-explanation",
        "exact_text_sha256": "06bd45c49bc003561ac881250014712d56eaa69e5ec6ad9ef04b3b9d7be60580",
        "source_kind": "writer_authored_proposal",
        "source_path": "fixtures/writer-decision-workspace/writer-proposals.md",
        "source_span_id": "proposal-span-proposal-add-relation-explanation"
      },
      "action": "accept",
      "application_status": "APPLIED_TO_CANDIDATE_SUCCESSOR",
      "applied": true,
      "decision_record_id": "decision-accept-relation-explanation",
      "impact_classification": "L2 relation or section impact",
      "proposal_id": "proposal-add-relation-explanation",
      "proposal_text": "台帳と失踪の関係を、因果未確認のまま一段だけ説明する。",
      "proposal_text_provenance": {
        "exact_text_sha256": "06bd45c49bc003561ac881250014712d56eaa69e5ec6ad9ef04b3b9d7be60580",
        "source_kind": "writer_authored_proposal",
        "source_path": "fixtures/writer-decision-workspace/writer-proposals.md",
        "source_span_id": "proposal-span-proposal-add-relation-explanation"
      },
      "regenerated_section_ids": [
        "case-digest-section-03-ledger"
      ]
    },
    {
      "action": "defer",
      "application_status": "DEFERRED_VISIBLE_UNAPPLIED",
      "applied": false,
      "decision_record_id": "decision-defer-structure-reorder",
      "impact_classification": "L3 format or structure impact",
      "proposal_id": "proposal-reorder-evidence-and-allegation",
      "proposal_text": "告発より先に台帳の証拠限界を提示する。",
      "proposal_text_provenance": {
        "exact_text_sha256": "9d92b5dad27a01e0111394b599b1ee10f172202fb264f4851935557622376b6b",
        "source_kind": "writer_authored_proposal",
        "source_path": "fixtures/writer-decision-workspace/writer-proposals.md",
        "source_span_id": "proposal-span-proposal-reorder-evidence-and-allegation"
      }
    },
    {
      "accepted_text_provenance": {
        "byte_range": {
          "end": 411,
          "start": 345
        },
        "character_range": {
          "end": 251,
          "start": 229,
          "unit": "utf16_code_unit"
        },
        "decision_record_id": "decision-accept-motive-undecided",
        "exact_text_sha256": "d860044d7e2bfc21a468a8bab4be36af36900782b9503e052af79918ee0e4e29",
        "source_kind": "writer_authored_proposal",
        "source_path": "fixtures/writer-decision-workspace/writer-proposals.md",
        "source_span_id": "proposal-span-proposal-mark-council-motive-undecided"
      },
      "action": "accept",
      "application_status": "APPLIED_TO_CANDIDATE_SUCCESSOR",
      "applied": true,
      "decision_record_id": "decision-accept-motive-undecided",
      "impact_classification": "L1 subject explanation",
      "proposal_id": "proposal-mark-council-motive-undecided",
      "proposal_text": "評議会の動機は作者判断まで未決定と明記する。",
      "proposal_text_provenance": {
        "exact_text_sha256": "d860044d7e2bfc21a468a8bab4be36af36900782b9503e052af79918ee0e4e29",
        "source_kind": "writer_authored_proposal",
        "source_path": "fixtures/writer-decision-workspace/writer-proposals.md",
        "source_span_id": "proposal-span-proposal-mark-council-motive-undecided"
      },
      "regenerated_section_ids": [
        "case-digest-section-04-council"
      ]
    },
    {
      "action": "defer",
      "application_status": "DEFERRED_VISIBLE_UNAPPLIED",
      "applied": false,
      "decision_record_id": "decision-defer-brother-survival",
      "impact_classification": "AUTHOR_DECISION_REQUIRED",
      "proposal_id": "proposal-attach-brother-survival-canon",
      "proposal_text": "兄は生存して潜伏している。",
      "proposal_text_provenance": {
        "exact_text_sha256": "e1189e51cd096a5af09c21d7ed6903d1ac932bae63f1e3d637e404f6ea26ea13",
        "source_kind": "writer_authored_proposal",
        "source_path": "fixtures/writer-decision-workspace/writer-proposals.md",
        "source_span_id": "proposal-span-proposal-attach-brother-survival-canon"
      }
    },
    {
      "action": "reject",
      "application_status": "REJECTED_FORBIDDEN_UNSUPPORTED_INFERENCE",
      "applied": false,
      "decision_record_id": "decision-reject-council-guilt",
      "impact_classification": "FORBIDDEN_UNSUPPORTED_INFERENCE",
      "proposal_id": "proposal-assert-council-guilt",
      "proposal_text": "評議会が事件を起こしたことは確定している。",
      "proposal_text_provenance": {
        "exact_text_sha256": "48e9a859ef3aa27ed48b453699c5231d281d5a6c333448266035a664bebdc628",
        "source_kind": "writer_authored_proposal",
        "source_path": "fixtures/writer-decision-workspace/writer-proposals.md",
        "source_span_id": "proposal-span-proposal-assert-council-guilt"
      }
    }
  ],
  "deferred_decision_ids": [
    "decision-defer-structure-reorder",
    "decision-defer-brother-survival"
  ],
  "final_canon": false,
  "format_reselection": {
    "deferred_l3_applied": false,
    "format_changed": false,
    "full_capacity_evaluation_performed": true,
    "selected_after": "CASE_DIGEST",
    "selected_before": "CASE_DIGEST",
    "trigger_proposal_ids": [
      "proposal-reorder-evidence-and-allegation"
    ],
    "triggered": true
  },
  "missing_decision_proposal_ids": [
    "proposal-clarify-moth-unknown",
    "proposal-remove-repeated-clue-wording"
  ],
  "regeneration_scope": {
    "affected_section_ids": [
      "case-digest-section-01-incident",
      "case-digest-section-03-ledger",
      "case-digest-section-04-council"
    ],
    "full_ir_regeneration_performed": false,
    "l2_section_local_only": true
  },
  "rejected_decision_ids": [
    "decision-reject-council-guilt"
  ],
  "schema_version": "fff.proposalApplicationResult.v1",
  "structural_diff": [
    {
      "after": {
        "caption_unit_id": "caption-case-digest-section-01-incident-1",
        "end_seconds": 12,
        "lineage": {
          "authority_ids": [],
          "decision_record_ids": [
            "decision-replace-opening-wording"
          ],
          "mode": "writer_authored_proposal",
          "source_span_ids": [
            "proposal-span-proposal-replace-opening-wording"
          ]
        },
        "section_or_beat_id": "case-digest-section-01-incident",
        "source_lineage": [
          {
            "byte_range": {
              "end": 301,
              "start": 229
            },
            "character_range": {
              "end": 185,
              "start": 161,
              "unit": "utf16_code_unit"
            },
            "decision_record_id": "decision-replace-opening-wording",
            "exact_text_sha256": "ec003f03d958ec74762ce04001c415a92a6e47c2beaded42a27be2da521ea547",
            "source_kind": "writer_authored_proposal",